{
  "format_version": "canton-solvency-proof-v1",
  "leaf": {
    "balances": {
      "CBTC": "9.250000000000000000",
      "USDA": "1.000000000000000001"
    },
    "salt": "332f77b30295afb7a346ba580de798bc08f3bada500905be6bd7a552c7eec458",
    "user_id": "22222222-2222-7222-8222-222222222222"
  },
  "report_digest": "0800c1047c9724ea429b238b01366f2032d674425d3ed745ed3402b2f534df61",
  "steps": [
    {
      "sibling_hash": "05666cf01538aa610cc1285d1acf84953a961bd8346154cec9fb8785bb626363",
      "sibling_on_left": true,
      "sibling_sums": {
        "USDA": "100.500000000000000000"
      }
    },
    {
      "sibling_hash": "171f5e7577171aeabb58b3013b0e0e2d0b9f45b387fe8b1ed2027be1a0d7108c",
      "sibling_on_left": false,
      "sibling_sums": {}
    }
  ]
}
